{
  "schema_version": "1.0.0",
  "request_id": "toolreq_01HZZ0COMPAREVERSIONSREQ00001",
  "tool_name": "compare_versions",
  "status": "ok",
  "completed_at": "2026-04-14T20:20:12Z",
  "result": {
    "comparison_report": {
      "schema_version": "1.0.0",
      "comparison_id": "compare_01HZZ0FIRSTSLICECOMPARE0001",
      "baseline": {
        "ref_type": "version",
        "ref_id": "ver_01HZZ0FIRSTSLICEBASE00000001"
      },
      "candidate": {
        "ref_type": "version",
        "ref_id": "ver_01HZZ0FIRSTSLICEEDIT00000001"
      },
      "generated_at": "2026-04-14T20:20:12Z",
      "metric_deltas": [
        {
          "metric": "spectral_balance.spectral_centroid_hz",
          "direction": "decreased",
          "delta": -340
        },
        {
          "metric": "spectral_balance.high_band_db",
          "direction": "decreased",
          "delta": -1.6
        },
        {
          "metric": "dynamics.crest_factor_db",
          "direction": "decreased",
          "delta": -0.3
        }
      ],
      "semantic_deltas": [
        {
          "label": "darker",
          "confidence": 0.83,
          "evidence": "High-band energy and spectral centroid both moved down."
        },
        {
          "label": "less_harsh",
          "confidence": 0.8,
          "evidence": "Upper-mid harshness annotation severity decreased from 0.52 to 0.29."
        }
      ],
      "regressions": [],
      "goal_alignment": [
        {
          "goal": "slightly reduce perceived brightness",
          "status": "met"
        },
        {
          "goal": "reduce upper-mid harshness",
          "status": "met"
        },
        {
          "goal": "preserve transient impact",
          "status": "mostly_met"
        }
      ],
      "verification_results": [
        {
          "target_id": "target_reduce_brightness_tilt",
          "goal": "slightly reduce perceived brightness",
          "label": "reduce high-band brightness modestly",
          "kind": "analysis_metric",
          "comparison": "decrease_by",
          "metric": "spectral_balance.high_band_db",
          "threshold": 0.75,
          "status": "met",
          "observed_delta": -1.6,
          "evidence": "Observed spectral_balance.high_band_db delta was -1.600."
        },
        {
          "target_id": "target_reduce_harshness_presence_band",
          "goal": "reduce upper-mid harshness",
          "label": "reduce upper-presence energy in the harshness region",
          "kind": "analysis_metric",
          "comparison": "decrease_by",
          "metric": "spectral_balance.presence_band_db",
          "threshold": 0.8,
          "status": "met",
          "observed_delta": -1.6,
          "evidence": "Observed spectral_balance.presence_band_db delta was -1.600."
        },
        {
          "target_id": "target_preserve_punch_crest_factor",
          "goal": "preserve transient impact",
          "label": "keep crest factor close to the baseline",
          "kind": "analysis_metric",
          "comparison": "at_least",
          "metric": "dynamics.crest_factor_db",
          "threshold": 9.8,
          "tolerance": 0.25,
          "status": "mostly_met",
          "observed_value": 10.1,
          "evidence": "Observed dynamics.crest_factor_db value was 10.100."
        }
      ],
      "evaluation_basis": {
        "metric_source": "analysis_reports",
        "goal_evaluation_source": "structured_verification",
        "authoritative_signal": "verification_results"
      },
      "summary": {
        "plain_text": "Measured changes suggest darker and less harsh. 3 of 3 structured verification checks were satisfied or mostly satisfied. No regression warnings were detected."
      }
    }
  },
  "warnings": []
}
